{
  "version": 1,
  "problem_id": "2026-A",
  "generated_at": "2026-09-04T12:00:00+08:00",
  "blind_context": {
    "mode": "live_competition",
    "solution_blind": true,
    "exposed_resources": [
      "仅填写实际看过的官方题面、附件和通用方法资源；搜索摘要也必须记录"
    ]
  },
  "constraints": {
    "innovation_budget_hours": 18,
    "max_primary_budget_hours": 10
  },
  "baseline": {
    "description": "写出能完整覆盖全部子问、可在有限时间内实现的透明基线。",
    "known_limitation": "指出基线在本题场景中的一个可观察缺陷，不能只写精度低或速度慢。",
    "comparison_metric": "写出统一样本、统一约束和统一预算下的比较指标。"
  },
  "candidates": [
    {
      "id": "I1",
      "title": "边界或事件点结构约简",
      "family": "structural_reduction",
      "target_subproblems": ["Q1"],
      "insight_sentence": "检验最优值或最坏情形是否只可能出现在有限个边界、事件或活跃约束上。",
      "problem_evidence": [{"locator": "题面页码/附件位置", "fact": "记录支持该结构假设的题面事实。"}],
      "baseline_failure": "说明基线为什么进行了不必要的全域搜索，或为什么遗漏了关键事件。",
      "structural_hypothesis": "写成可证明或可被反例推翻的单调性、凸性、事件性或局部性命题。",
      "mathematical_object_changes": ["constraint", "solver"],
      "exact_modification": "明确删除哪些变量、时刻、区域或枚举状态，并给出新的计算域。",
      "counterfactual": "若该结构不成立，说明基线和改进路线在什么实例上会产生不同结论。",
      "expected_consequence": "量化预期的维数、复杂度、运行时间、界或决策质量变化。",
      "falsifier": "构造覆盖边界内外的反例搜索，发现一个域外更优点即否定假设。",
      "minimum_experiment": {
        "id": "P-I1",
        "method": "在小规模实例上做完整枚举，并与约简后的候选集合逐项比较。",
        "independent_basis": "枚举器不得调用主求解器的候选筛选函数或共享其剪枝逻辑。",
        "metric": "最优值差与候选覆盖率",
        "acceptance_threshold": "最优值差为0且全部已知极值点被覆盖",
        "budget_hours": 1.5,
        "status": "planned"
      },
      "fallback": "结构假设失败时退回透明基线并保留已完成的枚举验证。",
      "failure_conditions": ["发现候选域外存在更优解", "证明依赖题面未给出的额外条件"],
      "ai_assessment": {"specificity": 0, "necessity": 0, "evidenceability": 0, "consequence": 0, "feasibility": 0, "independence": 0, "paper_value": 0},
      "stage": "idea"
    },
    {
      "id": "I2",
      "title": "机制分区与切换阈值",
      "family": "regime_switching",
      "target_subproblems": ["Q1"],
      "insight_sentence": "寻找决定简单机制与复杂机制切换的无量纲条件、阈值或活跃约束组合。",
      "problem_evidence": [{"locator": "题面页码/附件位置", "fact": "记录可能导致机制切换的容量、噪声、密度或成本事实。"}],
      "baseline_failure": "说明单一机制为什么会在某一题面区域产生系统偏差或错误决策。",
      "structural_hypothesis": "给出可计算的分区指标，并预测指标跨过阈值时模型或策略怎样切换。",
      "mathematical_object_changes": ["state", "constraint"],
      "exact_modification": "为各区间定义不同的状态方程、约束或决策规则，并保持边界一致。",
      "counterfactual": "如果不存在机制切换，分区模型不应显著优于同一套全局模型。",
      "expected_consequence": "报告阈值位置、稳定区间及错误使用另一机制产生的决策损失。",
      "falsifier": "在阈值两侧构造相同预算的对照实验，切换方向与预言不符则拒绝。",
      "minimum_experiment": {
        "id": "P-I2",
        "method": "选取阈值两侧的最小代表实例，分别拟合或求解两种机制。",
        "independent_basis": "分区标签来自题面变量或解析指标，不由拟合残差事后划定。",
        "metric": "阈值两侧相对损失",
        "acceptance_threshold": "切换模型在两侧均优于错误机制且方向预先确定",
        "budget_hours": 2,
        "status": "planned"
      },
      "fallback": "阈值证据不足时保留单一基线并把分区作为局限性讨论。",
      "failure_conditions": ["阈值对样本划分高度不稳定", "分区来自事后挑选"],
      "ai_assessment": {"specificity": 0, "necessity": 0, "evidenceability": 0, "consequence": 0, "feasibility": 0, "independence": 0, "paper_value": 0},
      "stage": "idea"
    },
    {
      "id": "I3",
      "title": "可辨识性约束与多源融合",
      "family": "identifiability",
      "target_subproblems": ["Q1"],
      "insight_sentence": "检查参数是否只能以组合形式出现，并寻找题面中的额外视角打破混淆。",
      "problem_evidence": [{"locator": "题面页码/附件位置", "fact": "记录多时间、多对象、多传感器或多场景信息。"}],
      "baseline_failure": "说明基线参数虽然能拟合数据，但单个参数不可稳定识别或解释。",
      "structural_hypothesis": "写出秩、灵敏度或等价变换条件，指出哪个新增信息能提高可辨识性。",
      "mathematical_object_changes": ["identifiability", "information"],
      "exact_modification": "重参数化不可辨识组合，或联合使用额外观测并加入辨识约束。",
      "counterfactual": "若基线已可辨识，新增信息不应显著改善秩、恢复误差或参数相关性。",
      "expected_consequence": "量化秩、条件数、参数区间、恢复误差或决策稳定性的改善。",
      "falsifier": "用合成真值恢复与轮廓似然检查，无法区分参数组合则否定创新。",
      "minimum_experiment": {
        "id": "P-I3",
        "method": "生成已知参数的小型合成样本，比较单源与多源的参数恢复。",
        "independent_basis": "真值由独立生成器设定，恢复程序不能读取真值或共享噪声实现。",
        "metric": "参数恢复误差与信息矩阵条件数",
        "acceptance_threshold": "恢复误差下降且条件数至少改善一个预定量级",
        "budget_hours": 2,
        "status": "planned"
      },
      "fallback": "无法辨识时只报告可辨识参数组合，不解释单个参数。",
      "failure_conditions": ["新增信息与原信息线性相关", "参数恢复仅依赖强先验"],
      "ai_assessment": {"specificity": 0, "necessity": 0, "evidenceability": 0, "consequence": 0, "feasibility": 0, "independence": 0, "paper_value": 0},
      "stage": "idea"
    },
    {
      "id": "I4",
      "title": "不确定性到决策闭环",
      "family": "uncertainty_decision",
      "target_subproblems": ["Q1"],
      "insight_sentence": "把观测和参数不确定性传播到最终方案，检验点估计决策是否会改变。",
      "problem_evidence": [{"locator": "题面页码/附件位置", "fact": "记录误差、缺失、波动、情景或未知参数来源。"}],
      "baseline_failure": "说明仅代入均值或点估计为什么可能违反约束或选择错误方案。",
      "structural_hypothesis": "定义决策损失和不确定性集合，预测哪些区间会发生方案切换。",
      "mathematical_object_changes": ["uncertainty", "objective", "constraint"],
      "exact_modification": "将点估计目标改为稳健、机会约束、风险度量或期望损失问题。",
      "counterfactual": "若不确定性不影响决策，稳健方案应退化为点估计方案且额外成本接近零。",
      "expected_consequence": "量化可行率、后悔值、风险、成本和决策切换边界。",
      "falsifier": "在预先定义的情景外样本评估，稳健方案没有降低失败率则拒绝。",
      "minimum_experiment": {
        "id": "P-I4",
        "method": "建立少量预注册情景，比较点估计方案与风险约束方案。",
        "independent_basis": "评估情景与优化情景分离，不能用同一批样本证明稳健性。",
        "metric": "样本外失败率与决策后悔",
        "acceptance_threshold": "失败率低于题面容许值且后悔增量在预算内",
        "budget_hours": 2.5,
        "status": "planned"
      },
      "fallback": "若决策不变，保留点模型并将不变区间作为可靠性证书。",
      "failure_conditions": ["不确定性集合无数据或题面依据", "只做参数扰动但不反馈决策"],
      "ai_assessment": {"specificity": 0, "necessity": 0, "evidenceability": 0, "consequence": 0, "feasibility": 0, "independence": 0, "paper_value": 0},
      "stage": "idea"
    },
    {
      "id": "I5",
      "title": "策略边界与相图",
      "family": "strategy_boundary",
      "target_subproblems": ["Q1"],
      "insight_sentence": "用关键比率或无量纲参数刻画最优策略发生切换的稳定区域。",
      "problem_evidence": [{"locator": "题面页码/附件位置", "fact": "记录至少两个相互竞争的成本、容量或风险尺度。"}],
      "baseline_failure": "说明只给一个参数点的最优方案为什么缺乏推广性和决策解释。",
      "structural_hypothesis": "预测策略切换边界的单调方向、极限状态和连续或跳变性质。",
      "mathematical_object_changes": ["objective", "state"],
      "exact_modification": "对关键比率做归一化，求解策略标签随参数变化的边界。",
      "counterfactual": "若不存在稳定分区，策略标签应在微小扰动下无规律频繁变化。",
      "expected_consequence": "给出稳定策略区、切换阈值及参数误差对决策的影响。",
      "falsifier": "在加密网格和随机扰动下复核边界，出现大面积不一致即否定。",
      "minimum_experiment": {
        "id": "P-I5",
        "method": "选择两个关键无量纲参数建立粗网格并标注最优策略。",
        "independent_basis": "边界复核使用加密网格或替代求解器，不复用粗网格插值。",
        "metric": "边界位置偏差与区域标签一致率",
        "acceptance_threshold": "加密后边界偏差小于预设阈值且标签一致率达标",
        "budget_hours": 2,
        "status": "planned"
      },
      "fallback": "边界不稳定时只报告局部敏感性，不声称普适相图。",
      "failure_conditions": ["参数无现实可解释性", "边界依赖求解器噪声"],
      "ai_assessment": {"specificity": 0, "necessity": 0, "evidenceability": 0, "consequence": 0, "feasibility": 0, "independence": 0, "paper_value": 0},
      "stage": "idea"
    },
    {
      "id": "I6",
      "title": "信息价值与最优补测",
      "family": "value_of_information",
      "target_subproblems": ["Q1"],
      "insight_sentence": "比较新增测量或样本对期望决策损失的降低，而不是只做特征重要性。",
      "problem_evidence": [{"locator": "题面页码/附件位置", "fact": "记录可增加、可选择或成本不同的测量与样本。"}],
      "baseline_failure": "说明现有信息导致哪一决策不确定，以及盲目增加数据为什么成本过高。",
      "structural_hypothesis": "预测哪类补测最能降低决策损失，并说明边际价值递减条件。",
      "mathematical_object_changes": ["information", "objective"],
      "exact_modification": "将采样或测量选择写成带成本的期望价值优化问题。",
      "counterfactual": "若新增信息没有决策价值，其成本调整后的预期损失不应改善。",
      "expected_consequence": "给出最优补测对象、数量、成本和预期决策损失降低。",
      "falsifier": "在保留样本上模拟补测，实际决策损失没有按预期下降则拒绝。",
      "minimum_experiment": {
        "id": "P-I6",
        "method": "比较三种候选补测在相同预算下对决策损失的影响。",
        "independent_basis": "价值评估使用未参与补测选择的保留样本或独立模拟。",
        "metric": "单位成本的决策损失下降",
        "acceptance_threshold": "最佳补测相对均匀补测达到预设增益",
        "budget_hours": 2,
        "status": "planned"
      },
      "fallback": "没有显著信息价值时建议不追加测量并报告原因。",
      "failure_conditions": ["只报告预测精度而未定义决策损失", "补测成本缺乏依据"],
      "ai_assessment": {"specificity": 0, "necessity": 0, "evidenceability": 0, "consequence": 0, "feasibility": 0, "independence": 0, "paper_value": 0},
      "stage": "idea"
    },
    {
      "id": "I7",
      "title": "结构感知求解器",
      "family": "structure_aware_solver",
      "target_subproblems": ["Q1"],
      "insight_sentence": "利用稀疏、可分、单调、几何或动态结构替代通用黑箱搜索。",
      "problem_evidence": [{"locator": "题面页码/附件位置", "fact": "记录稀疏连接、分阶段决策、局部相互作用或单调关系。"}],
      "baseline_failure": "说明通用求解器在哪种题面规模、约束或精度要求下不可接受。",
      "structural_hypothesis": "指出可利用的分解、递推、剪枝、事件或暖启动性质。",
      "mathematical_object_changes": ["solver", "constraint"],
      "exact_modification": "写出分解子问题、状态转移、剪枝条件或结构化搜索顺序。",
      "counterfactual": "若结构不存在，定制求解器不应在同等解质量下稳定优于通用基线。",
      "expected_consequence": "量化运行时间、内存、可行率、最优间隙或规模上限。",
      "falsifier": "在同一实例、停止准则和资源预算下比较，优势不显著则拒绝。",
      "minimum_experiment": {
        "id": "P-I7",
        "method": "实现最小结构化原型并与通用基线在三个规模上对照。",
        "independent_basis": "两种求解器共享输入和目标定义，但不共享结构化剪枝实现。",
        "metric": "同等可行性和目标误差下的运行时间",
        "acceptance_threshold": "达到预注册加速比且解质量不劣于容差",
        "budget_hours": 3,
        "status": "planned"
      },
      "fallback": "定制实现失败时使用通用基线并保留结构分析作为复杂度讨论。",
      "failure_conditions": ["只调整求解器参数", "比较使用不同精度或停止规则"],
      "ai_assessment": {"specificity": 0, "necessity": 0, "evidenceability": 0, "consequence": 0, "feasibility": 0, "independence": 0, "paper_value": 0},
      "stage": "idea"
    },
    {
      "id": "I8",
      "title": "最优性或可靠性证书",
      "family": "certificate",
      "target_subproblems": ["Q1"],
      "insight_sentence": "为核心结论提供界、间隙、覆盖率或约束裕度，而不只给求解器输出。",
      "problem_evidence": [{"locator": "题面页码/附件位置", "fact": "记录需要保证可行、安全、最优或可靠的核心输出。"}],
      "baseline_failure": "说明基线只能给候选结果，不能说明离最优多远或失败概率多大。",
      "structural_hypothesis": "给出可计算下界、松弛、区间包络、覆盖率或安全裕度。",